{
  "$schema": "https://json-schema.org/draft/2020-12/schema",
  "$id": "https://keryx.local/schemas/gdskills/subagent-dispatch.schema.json",
  "title": "Metaproject Subagent Dispatch",
  "type": "object",
  "additionalProperties": false,
  "required": [
    "contract_version",
    "run_id",
    "dispatch_id",
    "orchestrator",
    "target_skill",
    "task",
    "acceptance_criteria",
    "context_refs",
    "files_to_read",
    "constraints",
    "allowed_actions",
    "output_contract",
    "budget",
    "provenance"
  ],
  "properties": {
    "contract_version": { "type": "string", "pattern": "^[0-9]+\\.[0-9]+\\.[0-9]+$" },
    "run_id": { "type": "string", "minLength": 1 },
    "dispatch_id": { "type": "string", "minLength": 1 },
    "parent_dispatch_id": { "type": ["string", "null"] },
    "orchestrator": { "type": "string", "minLength": 1 },
    "target_skill": { "type": "string", "minLength": 1 },
    "task": {
      "type": "object",
      "additionalProperties": false,
      "required": ["title", "description"],
      "properties": {
        "title": { "type": "string", "minLength": 1 },
        "description": { "type": "string", "minLength": 1 },
        "intent": { "type": "string" },
        "scope": { "type": "string" }
      }
    },
    "acceptance_criteria": {
      "type": "array",
      "minItems": 1,
      "items": { "type": "string", "minLength": 1 }
    },
    "context_refs": {
      "type": "array",
      "items": { "$ref": "#/$defs/artifact_ref" }
    },
    "files_to_read": {
      "type": "array",
      "items": { "type": "string" }
    },
    "constraints": {
      "type": "array",
      "items": { "type": "string" }
    },
    "allowed_actions": {
      "type": "array",
      "items": {
        "type": "string",
        "enum": ["read", "write", "run-command", "network", "git", "ask-user", "spawn-subagent", "peer"]
      }
    },
    "output_contract": {
      "type": "object",
      "additionalProperties": false,
      "required": ["schema", "artifact_path"],
      "properties": {
        "schema": { "type": "string" },
        "artifact_path": { "type": "string" },
        "summary_max_tokens": { "type": "integer", "minimum": 50 }
      }
    },
    "budget": {
      "type": "object",
      "additionalProperties": false,
      "properties": {
        "max_prompt_tokens": { "type": ["integer", "null"], "minimum": 1000 },
        "max_output_tokens": { "type": ["integer", "null"], "minimum": 500 },
        "max_runtime_ms": { "type": ["integer", "null"], "minimum": 1000 },
        "max_findings": { "type": ["integer", "null"], "minimum": 1, "default": 10, "description": "Findings a reviewer may report. Per reviewer, not per review: a global cap on a fan-out is spent by whichever reviewer runs first. Blockers and merge-blocking findings are exempt and consume no budget. Applies to reported findings only, never to dismissal or refutation records - truncating those would rebuild the triage-survivor corpus that made precision unmeasurable." }
      }
    },
    "model": {
      "description": "Which model runs this dispatch. Skills declare a `tier`; at dispatch time src/gdskills/model-tier.ts DISCOVERS the models runtime provider detection reported for the active provider, ranks them by size markers in their names, and places the tier relative to the session's own model — `standard` is the session model, `deep` a discovered model ranked above it, `light` one ranked below. No table of model ids exists anywhere in the resolution. When the candidates cannot be ranked, every tier keeps the session's model. `provider`/`model` remain available for an explicit lateral selection, and an omitted block inherits the parent verbatim. Two things fill this block. The interactive `spawn_subagent` tool does it in code: it builds the tier map with `buildTierMap` from its host's detection result, hands it to `resolveChildModel`, and records the outcome on the dispatch's run trace. An orchestrator authoring a dispatch document fills it by calling `decideDispatchModel`, which returns exactly the fields below. Neither path is enforced by a reader — nothing validates a recorded resolution against the model that actually ran — so these fields are a record, not a gate.",
      "type": "object",
      "additionalProperties": false,
      "properties": {
        "provider": { "type": "string", "minLength": 1 },
        "model": { "type": "string", "minLength": 1 },
        "tier": {
          "description": "`light` is mechanical, verifiable work (pre-filter, class_scope existence checks, comment collection, formatting a reply); `standard` is ordinary reviewing and implementation and is the default; `deep` is genuinely hard reasoning (regression review across a blast radius, a strategy change after a failed loop, synthesis across many findings). An ENUM, not a free string, and that is the enforcement: a skill cannot write a model name into this field. The older `cheap` spelling frozen into docs/requirements/keryx-multi-agent-engine/schemas/child-model-selection.schema.json is still READ by parseModelTier, but is not accepted here — new dispatches use the three names above.",
          "type": "string",
          "enum": ["light", "standard", "deep"]
        },
        "tier_reasons": {
          "description": "The ordered rule ids `assignTier` applied, e.g. [\"base:standard\", \"floor:blast-radius\"]. Recorded so a tier can be explained after the run instead of re-derived from a state nobody kept. Ids rather than prose, because they are compared across runs.",
          "type": "array",
          "items": { "type": "string", "minLength": 1 }
        },
        "tier_resolution": {
          "description": "Which of three outcomes produced the model, as `resolveTierModel` reports it on `TierResolution.source`. `discovered` — a model reported by runtime provider detection was assigned to this tier. `session-ranked` — ranking WORKED and placed the tier at the session's own model (always so for `standard`; for `light`/`deep` when nothing discovered ranks below/above the session). `session-fallback` — ranking was refused, or the ranking carried no rank for the session model, so the session's model is used because nothing could be worked out. Collapsing the last two would hide whether the environment was understood. Recorded, never read back: it explains a finished run and gates nothing.",
          "type": "string",
          "enum": ["discovered", "session-ranked", "session-fallback"]
        },
        "model_discovery": {
          "description": "What was on the table when the tier was resolved: which models runtime detection reported for the active provider, how the size-marker hints ordered them, and — when ranking was refused — why. `tier_resolution` alone says a fallback happened and never says what it fell back FROM.",
          "type": "object",
          "additionalProperties": false,
          "required": ["provider", "candidates", "ranked", "session_rank", "fallback_reason"],
          "properties": {
            "provider": {
              "description": "The provider whose catalogue was consulted. Always the session's own: candidates are never taken from a provider the parent holds no grant for.",
              "type": "string"
            },
            "candidates": {
              "description": "Every model discovered for that provider, de-duplicated, in the order detection reported it. Empty when nothing was discovered.",
              "type": "array",
              "items": { "type": "string", "minLength": 1 }
            },
            "ranked": {
              "description": "The subset the hints could place, best first. A candidate absent from this list carried no size marker and was therefore not orderable — recorded by its absence rather than by a guessed rank.",
              "type": "array",
              "items": {
                "type": "object",
                "additionalProperties": false,
                "required": ["model", "rank"],
                "properties": {
                  "model": { "type": "string", "minLength": 1 },
                  "rank": { "description": "Ordinal only. Absolute values mean nothing; only comparisons between candidates are read.", "type": "integer" }
                }
              }
            },
            "session_rank": {
              "description": "Where the session's own model sits in the same ordering, or null when the hints could not place it — which is itself a refusal to rank, because nothing can be called above or below an unplaced anchor.",
              "type": ["integer", "null"]
            },
            "fallback_reason": {
              "description": "Why ranking was refused, or null when it was not. Prose, because it is read by a person reconstructing a run and never compared across runs.",
              "type": ["string", "null"]
            }
          }
        },
        "inherit": { "type": "boolean" }
      }
    },
    "runtime": {
      "description": "Which child runtime executes this dispatch (flow 176; docs/requirements/keryx-external-agent-runtime). Additive and optional: an absent block means the native keryx runtime, so every dispatch authored before this package stays valid. Constraints this schema cannot express — the agent resolving in the registry, the sandbox appearing in that agent's supported modes, and read-only versus allowed_actions — are enforced fail-closed by the pure validator in src/harness/external/dispatch.ts.",
      "type": "object",
      "additionalProperties": false,
      "required": ["kind"],
      "properties": {
        "kind": {
          "description": "`keryx` runs the in-process agent loop; `external` spawns a vendor CLI subprocess.",
          "type": "string",
          "enum": ["keryx", "external"]
        },
        "agent": {
          "description": "Registry id of the external agent. Required when kind is `external`.",
          "type": "string",
          "minLength": 1
        },
        "sandbox": {
          "description": "Permission level for the external child. `worktree-write` is schema-valid but refused at runtime in the read-only release, with a reason distinguishable from an unsupported-by-this-agent refusal.",
          "type": "string",
          "enum": ["read-only", "worktree-write"]
        },
        "model": {
          "description": "Model id passed to the external CLI. Omit or null to let the CLI resolve its own default under the operator's active subscription — keryx never pins a model the account may not be entitled to.",
          "type": ["string", "null"],
          "minLength": 1
        },
        "timeoutMs": { "type": ["integer", "null"], "minimum": 1000 },
        "maxCostUnits": { "type": ["number", "null"], "exclusiveMinimum": 0 }
      },
      "allOf": [
        {
          "if": { "properties": { "kind": { "const": "external" } }, "required": ["kind"] },
          "then": { "required": ["agent", "sandbox"] }
        },
        {
          "if": { "properties": { "kind": { "const": "keryx" } }, "required": ["kind"] },
          "then": { "not": { "required": ["agent"] } }
        }
      ]
    },
    "provenance": {
      "type": "object",
      "additionalProperties": true,
      "required": ["created_at", "created_by"],
      "properties": {
        "created_at": { "type": "string", "format": "date-time" },
        "created_by": { "type": "string" },
        "source_request": { "type": "string" }
      }
    }
  },
  "$defs": {
    "artifact_ref": {
      "type": "object",
      "additionalProperties": false,
      "required": ["path", "kind", "exists"],
      "properties": {
        "path": { "type": "string" },
        "kind": {
          "type": "string",
          "enum": ["context", "graph", "wiki", "memory", "health", "diff", "report", "plan", "review", "custom"]
        },
        "exists": { "type": "boolean" },
        "summary": { "type": "string" },
        "hash": { "type": ["string", "null"] }
      }
    }
  }
}
