{
  "contract_version": "1.0.0",
  "run_id": "232",
  "dispatch_id": "232-T7",
  "orchestrator": "flow-orchestrator",
  "target_skill": "task-implementer",
  "task": {
    "title": "M01 shared routing entrypoint writer",
    "description": "Make T5 RED tests green by introducing the shared pair render/write owner used by init/update/rules sync/distill. Preserve module/security/user flags, short index and full routing; pair failure must be observable and rerun recoverable. Update affected orient/catalog consumers and tests honestly; preserve public APIs. Read task input T7-input.json.",
    "intent": "implement"
  },
  "acceptance_criteria": [
    "AC1: M01: init, rules sync, rules distill, update and repeated sequences preserve a short index plus full routing document through a shared writer; enabled module/security flags and user-owned entrypoint blocks are preserved.",
    "AC2: M01: orient/catalog and related consumers resolve the split entrypoint, regression fixtures assert correct ownership of both documents, failed pair publication is observable and recoverable on rerun without a false success."
  ],
  "context_refs": [
    {
      "path": "~/goodea/keryx/.metaproject/flows/232-2026-09-06-agent-first-core-phase-0/context.md",
      "kind": "context",
      "exists": true
    },
    {
      "path": "~/goodea/keryx/.metaproject/flows/232-2026-09-06-agent-first-core-phase-0/plan.md",
      "kind": "plan",
      "exists": true
    },
    {
      "path": "~/goodea/keryx/.metaproject/flows/232-2026-09-06-agent-first-core-phase-0/acceptance-criteria.md",
      "kind": "custom",
      "exists": true
    },
    {
      "path": "~/goodea/keryx/.metaproject/flows/232-2026-09-06-agent-first-core-phase-0/artifacts/T5-test-case-specs.json",
      "kind": "custom",
      "exists": true
    },
    {
      "path": "~/goodea/keryx/.metaproject/flows/232-2026-09-06-agent-first-core-phase-0/artifacts/T5-red-evidence.md",
      "kind": "custom",
      "exists": true
    }
  ],
  "files_to_read": [
    "~/goodea/keryx/src/lib/templates.ts",
    "~/goodea/keryx/src/commands/init.ts",
    "~/goodea/keryx/src/commands/update.ts",
    "~/goodea/keryx/src/commands/rules.ts",
    "~/goodea/keryx/src/commands/rules.test.ts",
    "~/goodea/keryx/src/lib/templates.test.ts",
    "~/goodea/keryx/src/gdskills/catalog.ts",
    "~/goodea/keryx/src/ctx/orient.ts",
    "~/goodea/keryx/src/commands/routing-entrypoint-lifecycle.test.ts"
  ],
  "constraints": [
    "Read ~/goodea/keryx/.metaproject/index.md before code searches/reads.",
    "Use local tests-creator skill and testing context; graph/wiki before deeper reads, keryx ctx rg only for code search.",
    "Do not edit flow.json or frozen acceptance criteria; parent owns all flow transitions.",
    "Stats disabled; no external model calls, no private dataset copying.",
    "Do not modify unrelated files. Coordinate shared test file ownership before edits.",
    "Return STATUS first and validate subagent-result; persist RED command/output and test_case_specs in artifacts.",
    "Production ownership: src/lib/templates.ts, new narrow shared routing writer, src/commands/init.ts/update.ts/rules.ts, src/ctx/orient.ts and src/gdskills/catalog.ts plus direct associated tests. Do not touch src/commands/agent.ts, scripts, package.json, schema bootstrap or other source modules without coordinating parent.",
    "Use bun src/cli.ts skills contracts validate for task-implementer-input: global compiled keryx still ships the old issue-required schema. This is source CLI, not bypassing validation.",
    "Task input automation auto_commit=false and skip_confirmation=true. Meaningful tests remain; do not weaken acceptance to pass. Full root suite/review owned by root separately.",
    "Read full local task-implementer skill (compact output omits phases); persist implementation report/results."
  ],
  "allowed_actions": [
    "read",
    "write",
    "run-command"
  ],
  "output_contract": {
    "schema": "subagent-result",
    "artifact_path": "~/goodea/keryx/.metaproject/flows/232-2026-09-06-agent-first-core-phase-0/artifacts/T7-result.json"
  },
  "budget": {
    "max_output_tokens": null
  },
  "provenance": {
    "created_at": "2026-09-06T10:52:34.800152+00:00",
    "created_by": "flow-orchestrator"
  }
}
