{
  "contract_version": "1.0.0",
  "run_id": "232",
  "dispatch_id": "232-T15",
  "orchestrator": "flow-orchestrator",
  "target_skill": "review-logic",
  "task": {
    "title": "Independent M01 routing review",
    "description": "Review only the M01 routing changes authored by a different worker. Stage 1: verify AC1 and AC2 from flow acceptance plus T7 implementation report; proceed to Stage 2 logic/edge cases only when Stage 1 passes. Inspect pair renderer/writer, all init/update/rules sync/distill writers, flags preservation, orient/catalog consumers and tests. Root merges review outcomes; no source edits.",
    "intent": "review"
  },
  "acceptance_criteria": [
    "AC1 and AC2 behavior is met in production code with credible lifecycle tests.",
    "No reproducible major/blocker logic defects; failures and recovery are truthful, no lost user blocks or divergent writers."
  ],
  "context_refs": [
    {
      "path": "~/goodea/keryx/.metaproject/flows/232-2026-09-06-agent-first-core-phase-0/artifacts/T7-verification.md",
      "kind": "custom",
      "exists": true
    },
    {
      "path": "~/goodea/keryx/.metaproject/flows/232-2026-09-06-agent-first-core-phase-0/artifacts/T7-result.json",
      "kind": "custom",
      "exists": true
    }
  ],
  "files_to_read": [
    "~/goodea/keryx/src/lib/routing-entrypoint.ts",
    "~/goodea/keryx/src/lib/templates.ts",
    "~/goodea/keryx/src/commands/init.ts",
    "~/goodea/keryx/src/commands/update.ts",
    "~/goodea/keryx/src/commands/rules.ts",
    "~/goodea/keryx/src/ctx/orient.ts",
    "~/goodea/keryx/src/gdskills/catalog.ts",
    "~/goodea/keryx/src/commands/routing-entrypoint-lifecycle.test.ts"
  ],
  "constraints": [
    "Read ~/goodea/keryx/.metaproject/index.md first; local review-logic SKILL.md fully, testing context, graph/wiki as appropriate.",
    "Base 0bc6418fa1a038f8ec909cf949fecba077acf9a4; branch codex/agent-first-core; uncommitted M01 changes only. No git/flow/source edits.",
    "Do not review own M10 code. Root HTTP/Shell and bootstrap outside this lane. Do not rerun global suite while verifier runs; bounded reproductions if needed.",
    "Stats disabled. No real model calls. STATUS first; subagent-result schema. Spec compliance before quality; stop quality on missing AC (project gate overrides generic skill)."
  ],
  "allowed_actions": [
    "read",
    "write",
    "run-command"
  ],
  "output_contract": {
    "schema": "subagent-result",
    "artifact_path": "~/goodea/keryx/.metaproject/flows/232-2026-09-06-agent-first-core-phase-0/artifacts/T15-result.json"
  },
  "budget": {
    "max_output_tokens": null
  },
  "provenance": {
    "created_at": "2026-09-06T11:20:02.850242+00:00",
    "created_by": "flow-orchestrator"
  }
}
